[
 {"id":"1.1.1","title":"Ensure 'Password must meet complexity requirements' is set to 'Enabled'","section":"1.1","levels":[1], "platforms":["Server","Workstation"],"assessment":"Automated", "family":"password-complexity","params":{},"risk":"safe","page":48},
 {"id":"1.1.2","title":"Ensure 'Minimum password length' is set to '14 or more character(s)'","section":"1.1","levels":[1], "platforms":["Server","Workstation"],"assessment":"Automated", "family":"password-policy","params":{"key":"MinimumPasswordLength","expected":14},"risk":"safe","page":52},
 {"id":"1.1.3","title":"Ensure 'Maximum password age' is set to '60 or fewer days, but not 0'","section":"1.1","levels":[1], "platforms":["Server","Workstation"],"assessment":"Automated", "family":"password-policy","params":{"key":"MaximumPasswordAge","expected":60,"op":"le"},"risk":"safe","page":56},
 {"id":"1.1.4","title":"Ensure 'Enforce password history' is set to '24 or more password(s)'","section":"1.1","levels":[1], "platforms":["Server","Workstation"],"assessment":"Automated", "family":"password-policy","params":{"key":"PasswordHistorySize","expected":24},"risk":"safe","page":59},
 {"id":"1.1.5","title":"Ensure 'Store passwords using reversible encryption' is set to 'Disabled'","section":"1.1","levels":[1], "platforms":["Server","Workstation"],"assessment":"Automated", "family":"password-reversible","params":{},"risk":"safe","page":62},

 {"id":"1.2.1","title":"Ensure 'Account lockout duration' is set to '15 or more minute(s)'","section":"1.2","levels":[1], "platforms":["Server","Workstation"],"assessment":"Automated", "family":"lockout-policy","params":{"key":"LockoutDuration","expected":15,"op":"ge"},"risk":"safe","page":66},
 {"id":"1.2.2","title":"Ensure 'Account lockout threshold' is set to '5 or fewer invalid logon attempt(s)'","section":"1.2","levels":[1], "platforms":["Server","Workstation"],"assessment":"Automated", "family":"lockout-policy","params":{"key":"LockoutBadCount","expected":5},"risk":"safe","page":69},
 {"id":"1.2.3","title":"Ensure 'Reset account lockout counter after' is set to '15 or more minute(s)'","section":"1.2","levels":[1], "platforms":["Server","Workstation"],"assessment":"Automated", "family":"lockout-policy","params":{"key":"ResetLockoutCount","expected":15,"op":"ge"},"risk":"safe","page":72},

 {"id":"2.1.1","title":"Ensure 'Audit Credential Validation' is set to 'Success and Failure'","section":"2.1","levels":[1], "platforms":["Server","Workstation"],"assessment":"Automated", "family":"audit-policy","params":{"subcategory":"Credential Validation","expected":"Success and Failure"},"risk":"safe","page":88},
 {"id":"2.1.2","title":"Ensure 'Audit Logon' is set to 'Success and Failure'","section":"2.1","levels":[1], "platforms":["Server","Workstation"],"assessment":"Automated", "family":"audit-policy","params":{"subcategory":"Logon","expected":"Success and Failure"},"risk":"safe","page":95},
 {"id":"2.1.3","title":"Ensure 'Audit Account Lockout' is set to 'Success and Failure'","section":"2.1","levels":[1], "platforms":["Server","Workstation"],"assessment":"Automated", "family":"audit-policy","params":{"subcategory":"Account Lockout","expected":"Success and Failure"},"risk":"safe","page":102},

 {"id":"4.1.1","title":"Ensure 'Network security: LAN Manager authentication level' is set to 'Send NTLMv2 response only. Refuse LM & NTLM'","section":"4.1","levels":[1], "platforms":["Server","Workstation"],"assessment":"Automated", "family":"lanman-auth","params":{"path":"HKLM:\\SYSTEM\\CurrentControlSet\\Control\\Lsa","name":"LmCompatibilityLevel","value":5},"risk":"safe","page":204},
 {"id":"4.1.2","title":"Ensure 'Microsoft network server: Digitally sign communications (always)' is set to 'Enabled'","section":"4.1","levels":[1], "platforms":["Server","Workstation"],"assessment":"Automated", "family":"smb-signing","params":{"path":"HKLM:\\SYSTEM\\CurrentControlSet\\Services\\LanManServer\\Parameters","name":"RequireSecuritySignature","value":1},"risk":"disruptive","page":216},
 {"id":"4.1.3","title":"Ensure 'Microsoft network client: Digitally sign communications (always)' is set to 'Enabled'","section":"4.1","levels":[1], "platforms":["Server","Workstation"],"assessment":"Automated", "family":"smb-signing","params":{"path":"HKLM:\\SYSTEM\\CurrentControlSet\\Services\\LanmanWorkstation\\Parameters","name":"RequireSecuritySignature","value":1},"risk":"safe","page":219},

 {"id":"5.1.1","title":"Ensure 'Windows Firewall: Domain: Firewall state' is set to 'On'","section":"5.1","levels":[1], "platforms":["Server","Workstation"],"assessment":"Automated", "family":"firewall-profile","params":{"profile":"Domain"},"risk":"disruptive","page":248},
 {"id":"5.1.2","title":"Ensure 'Windows Firewall: Private: Firewall state' is set to 'On'","section":"5.1","levels":[1], "platforms":["Server","Workstation"],"assessment":"Automated", "family":"firewall-profile","params":{"profile":"Private"},"risk":"disruptive","page":252},
 {"id":"5.1.3","title":"Ensure 'Windows Firewall: Public: Firewall state' is set to 'On'","section":"5.1","levels":[1], "platforms":["Server","Workstation"],"assessment":"Automated", "family":"firewall-profile","params":{"profile":"Public"},"risk":"disruptive","page":256},

 {"id":"6.1.1","title":"Ensure 'Configure Automatic Updates' is set to 'Auto download and notify for install'","section":"6.1","levels":[1], "platforms":["Server","Workstation"],"assessment":"Automated", "family":"wu-config","params":{"path":"HKLM:\\SOFTWARE\\Policies\\Microsoft\\Windows\\WindowsUpdate\\AU","name":"AUOptions","value":3},"risk":"safe","page":275},

 {"id":"7.1.1","title":"Ensure 'User Account Control: Admin Approval Mode' is enabled","section":"7.1","levels":[1], "platforms":["Server","Workstation"],"assessment":"Automated", "family":"uac","params":{"path":"HKLM:\\SOFTWARE\\Microsoft\\Windows\\CurrentVersion\\Policies\\System","name":"EnableLUA","value":1},"risk":"disruptive","page":292},
 {"id":"7.1.2","title":"Ensure 'User Account Control: Behavior of the elevation prompt for administrators' is set to 'Prompt for consent'","section":"7.1","levels":[1], "platforms":["Server","Workstation"],"assessment":"Automated", "family":"uac","params":{"path":"HKLM:\\SOFTWARE\\Microsoft\\Windows\\CurrentVersion\\Policies\\System","name":"ConsentPromptBehaviorAdmin","value":2},"risk":"safe","page":296},

 {"id":"8.1.1","title":"Ensure 'Remote Desktop Services: Require Network Level Authentication' is enabled","section":"8.1","levels":[1], "platforms":["Server","Workstation"],"assessment":"Automated", "family":"rdp-nla","params":{"path":"HKLM:\\SYSTEM\\CurrentControlSet\\Control\\Terminal Server\\WinStations\\RDP-Tcp","name":"UserAuthentication","value":1},"risk":"disruptive","page":314},

 {"id":"9.1.1","title":"Ensure 'Application: Control Event Log' maximum log size is 32,768 KB or greater","section":"9.1","levels":[1], "platforms":["Server","Workstation"],"assessment":"Automated", "family":"eventlog-size","params":{"log":"Application","min_size_mb":32},"risk":"safe","page":330},
 {"id":"9.1.2","title":"Ensure 'Security: Security Log' maximum log size is 196,608 KB or greater","section":"9.1","levels":[1], "platforms":["Server","Workstation"],"assessment":"Automated", "family":"eventlog-size","params":{"log":"Security","min_size_mb":192},"risk":"safe","page":333},
 {"id":"9.1.3","title":"Ensure 'System: System Log' maximum log size is 32,768 KB or greater","section":"9.1","levels":[1], "platforms":["Server","Workstation"],"assessment":"Automated", "family":"eventlog-size","params":{"log":"System","min_size_mb":32},"risk":"safe","page":336},

 {"id":"10.1.1","title":"Ensure 'Windows PowerShell script block logging' is enabled","section":"10.1","levels":[1], "platforms":["Server","Workstation"],"assessment":"Automated", "family":"ps-logging","params":{"path":"HKLM:\\SOFTWARE\\Policies\\Microsoft\\Windows\\PowerShell\\ScriptBlockLogging","name":"EnableScriptBlockLogging","value":1},"risk":"safe","page":354},
 {"id":"10.1.2","title":"Ensure PowerShell execution policy is 'Restricted' or 'RemoteSigned'","section":"10.1","levels":[1], "platforms":["Server","Workstation"],"assessment":"Automated", "family":"ps-execution","params":{},"risk":"safe","page":358},

 {"id":"11.1.1","title":"Ensure 'Windows Time' service (W32Time) is running and set to 'Automatic'","section":"11.1","levels":[1], "platforms":["Server","Workstation"],"assessment":"Automated", "family":"service-state","params":{"name":"W32Time","state":"Running"},"risk":"safe","page":370},
 {"id":"11.1.2","title":"Ensure 'Print Spooler' service is disabled (unless required)","section":"11.1","levels":[2], "platforms":["Server"],"assessment":"Automated", "family":"service-state","params":{"name":"Spooler","state":"Disabled"},"risk":"disruptive","page":374},

 {"id":"12.1.1","title":"Ensure 'Domain member: Digitally encrypt secure channel data' is enabled","section":"12.1","levels":[1], "platforms":["Server","Workstation"],"assessment":"Automated", "family":"lanman-auth","params":{"path":"HKLM:\\SYSTEM\\CurrentControlSet\\Services\\Netlogon\\Parameters","name":"SealSecureChannel","value":1},"risk":"safe","page":402},
 {"id":"12.1.2","title":"Ensure 'Domain member: Digitally sign secure channel data' is enabled","section":"12.1","levels":[1], "platforms":["Server","Workstation"],"assessment":"Automated", "family":"lanman-auth","params":{"path":"HKLM:\\SYSTEM\\CurrentControlSet\\Services\\Netlogon\\Parameters","name":"SignSecureChannel","value":1},"risk":"safe","page":405}
]
